id|publishedAt|channelId|title|description|thumbnailUrl|tags|category|defaultLanguage|duration|caption|viewCount|likeCount|dislikeCount|commentCount
1RHLWd6NOcI|2016-04-15T06:58:33Z|UCKfDOknt5Ia7wjWCYbQwefQ|"안전관련 동영상 홍보_자동제세동기사용 요령"|"자동제세동기(AED) 사용 요령  자동제세동기(AED)는 심장의 기능이 정지하거나 호흡이 멈추었을 때 사용하는 응급처치 기기로서 정상적인 호흡과 반응이 없는 심정지 환자에게만 사용합니다. 누구나 자동제세동기를 사용해 소중한 생명을 살릴 수 있습니다. 서울메트로 서울지하철 1~4호선 각 역마다 1대씩 비치하고 있습니다.  자동제세동기(AED) 사용 방법 1. 전원켜기  - 자동제세동기를 심폐소생술에 방해되지 않는 위치에 놓은 뒤 덮개를 열고 전원 버튼을 누릅니다. 2. 두 개의 패드 부착  - 패드 부착 부위에 이물질이 있다면 제거 후 가슴과 옆구리에 부착합니다. 3. 심장리듬 분석  - 자동제세동기에서 “분석 중”이라는 음성 메시지가 나오면 심폐소생술을 멈추고 환자에게서 모두 손을 뗍니다. 4. 제세동 시행  - 제세동이 필요한 경우에 제세동 버튼이 깜빡이며 에너지가 충전됩니다.  - 제세동 버튼을 누르기 전에 반드시 환자에게서 모든 사람이 떨어져 있는지 확인합니다.  - 제세동 버튼을 누르면 제세동이 작동됩니다. 5. 심폐소생술  - 제세동 사용 후엔 즉시 가슴압박을 시행합니다.   (119 구급대가 도착할 때까지 제세동기와 심폐소생술을 함께 시행)  고객의 안전을 위해 더욱 노력하는 서울메트로가 되겠습니다."|https://i.ytimg.com/vi/1RHLWd6NOcI/default.jpg|NULL|22|NULL|PT1M53S|false|2400|5|0|0
Hx3znI1gdb4|2016-04-08T08:38:16Z|UCKfDOknt5Ia7wjWCYbQwefQ|"안전관련 동영상 홍보_지하철 폭발물 테러(대합실편)"|"지하철 폭발물 테러(대합실) 시 대처 요령  지하철 테러 발생 즉시 119, 112, 1577-1234(서울메트로 콜센터) 또는 02-572-3023(테러정보통합센터)으로 신고합니다.  소화기·소화전으로 초기 화재를 진화합니다.  대피 시 엘리베이터 탑승은 절대 금지  유독 가스 발생 시에는 호흡기 보호를 위해 방독면을 착용하거나 물수건으로 코와 입을 가리고 낮은 자세로 직원 안내에 따라 계단을 통해 신속하게 대피합니다.  환자 응급처치 및 구호 조치합니다."|https://i.ytimg.com/vi/Hx3znI1gdb4/default.jpg|NULL|22|NULL|PT1M11S|false|9591|36|1|4
KbEqnePObcg|2016-04-01T08:20:00Z|UCKfDOknt5Ia7wjWCYbQwefQ|"안전관련 동영상 홍보_열차 출입문 비상개폐장치 사용 시 주의사항"|"열차 출입문 비상개폐장치 사용 시 주의사항  출입문 비상개폐장치는 화재 등 비상상황에서만 사용하여 주십시오. 임의로 출입문 비상개폐장치 손잡이를 돌리면 열차가 급정차하는 위험한 상황이 발생할 수 있으며 철도안전법에 따라 처벌 받을 수 있습니다.  지하철 안전! 시민 여러분의 협조로 함께 지킬 수 있습니다."|https://i.ytimg.com/vi/KbEqnePObcg/default.jpg|NULL|22|NULL|PT23S|false|1689|9|0|0
JE5_GMbINuE|2016-03-25T09:10:38Z|UCKfDOknt5Ia7wjWCYbQwefQ|"안전관련 동영상 홍보_화재용 마스크 사용 요령"|"화재용 마스크 사용 요령  각 역사 대합실 및 승강장에 구호용품 보관함이 설치되어 있습니다.  화재 시 - 구호용품 보관함을 열고 마스크가 들어있는 은박 포장 팩을 꺼냅니다. - 봉지를 찢고 마스크를 꺼냅니다. - 끈을 당겨서 보호마개를 제거합니다. - 양손으로 잡고 마스크를 착용합니다. - 정화통을 확인하고 머리끈을 당깁니다.   · 화재 시 인명피해가 발생하는 70~80%는 유독가스 때문입니다. - 마스크 사용이 어려울 때에는 구호용품 보관함에 비치되어 있는 손수건에 물을 적신 후 입과 코를 가리고 대피하시기 바랍니다."|https://i.ytimg.com/vi/JE5_GMbINuE/default.jpg|NULL|22|NULL|PT52S|false|5604|14|0|1
l98zA4JGlIg|2016-03-18T06:32:10Z|UCKfDOknt5Ia7wjWCYbQwefQ|"안전관련 동영상 홍보_비상시 터널탈출 요령"|""|https://i.ytimg.com/vi/l98zA4JGlIg/default.jpg|"지하철안전"|22|NULL|PT2M16S|false|13662|37|2|5
0u4sbutzc0g|2015-07-10T05:53:02Z|UCKfDOknt5Ia7wjWCYbQwefQ|"2015 서울 지하철 스탬프 투어"|"지하철을 타고 떠나는 서울 여행, 서울지하철 스탬프 투어의  각 코스별 서울의 역사문화 명소들을 여행하고 인증샷(2컷, 서로 다른 장소)을 찍어 오시면 해당 코스의 지하철역에서 스템프를 날인하여 드리고, 12개 코스 중 8개 코스 이상 스탬프를 받으신 후 서울메트로 홈페이지에서 완주인증서 등록과 기념품 신청을 하면  선착순 1,000분에게 완주 기념품을 드립니다."|https://i.ytimg.com/vi/0u4sbutzc0g/default.jpg|"서울메트로지하철스탬프 투어SeoulSeoulmetrosubwaystamp tourmetrosubwaystation역사문화탐방스탬프"|22|NULL|PT54S|false|4087|6|1|0
8zh9SyZDMb0|2015-04-29T05:10:55Z|UCKfDOknt5Ia7wjWCYbQwefQ|"역무원은 괴로워"|"지하철 역무원 55%, 승객으로부터 폭행당한 경험 있다."|https://i.ytimg.com/vi/8zh9SyZDMb0/default.jpg|"서울메트로역무원지하철폭행승객"|22|NULL|PT1M53S|false|9653|83|3|38
