id|publishedAt|channelId|title|description|thumbnailUrl|tags|category|defaultLanguage|duration|caption|viewCount|likeCount|dislikeCount|commentCount
9L2EAivvBHI|2019-08-27T07:00:51Z|UCM_0SZaSF2KSxQZiYOIcCfg|"[DMZ 평화경제 국제포럼] 국문 홍보영상"|"[DMZ 평화경제 국제포럼] 국문 홍보영상  대외경제정책연구원(KIEP)과 경제·인문사회연구회는 오는 8월 28~29일 양일간 DMZ 일대 및 서울 롯데호텔에서 “평화경제와 한반도의 번영”을 주제로 "DMZ 평화경제 국제포럼"을 개최합니다.  KIEP을 포함한 14개 국책연구기관이 공동주관하며 통일부, 서울시, 인천시가 후원하는 이번 행사는 전직 대통령, 총리 등을 포함한 해외 고위급 인사와 세계 유수의 싱크탱크 기관장, 국내외 저명인사들이 참석한 가운데 진행됩니다.  "DMZ 평화경제 국제포럼"에서는 정부의 한반도 평화경제 정책을 둘러싼 심도 있는 논의가 이루어집니다. 한반도 신경제구상을 토대로 신남방, 신북방정책과의 연계성, 국제사회와의 협력을 통한 지속가능한 발전 방향을 모색할 예정입니다. 나아가 국제사회에 한반도 평화경제의 의미와 중요성을 설파하고 공감대를 형성하고자 합니다.  자세한 내용은 "DMZ 평화경제 국제포럼 홈페이지" 및 "KIEP 홈페이지"를 통해 확인하세요!  ▶ DMZ 평화경제 국제포럼 홈페이지에서 내용 더 보기-  http:www.dmzpeaceforum.org ▶ KIEP 홈페이지에서 내용 더 보기- http:bit.ly2Npswvv  #대외경제정책연구원 #KIEP #국제포럼 #개최 #DMZ평화경제국제포럼 #평화경제 #한반도번영 #논의 #경제인문사회연구회 #14개국책연구기관 #통일부 #서울시 #인천시 #함께합니다"|https://i.ytimg.com/vi/9L2EAivvBHI/default.jpg|"대외경제정책연구원KIEP국제포럼개최DMZ평화경제국제포럼한반도번영논의경제인문사회연구회통일부서울시인천시#한반도평화#한반도#DMZ평화경제"|27|NULL|PT1M25S|false|250|4|0|0
AKO3vTHffyk|2019-08-07T09:00:21Z|UCM_0SZaSF2KSxQZiYOIcCfg|"[Vol.10] 글로벌 이슈브리핑  중국·미국, 말레이시아·중국"|"[Vol.10] 글로벌 이슈브리핑  중국·미국, 말레이시아·중국   대외경제정책연구원은 "KIEP 글로벌 이슈브리핑 코너"를 통해 KIEP 연구진 자료를 토대로 한 최신 국제이슈, 중요 글로벌동향을 전하고 있습니다.  금주 살펴볼 곳은 '중국·미국'과 '말레이시아·중국' 입니다.ㆆᴗㆆ  [중국·미국] 제12차 미·중 고위급 무역협상 상하이 개최  중국과 미국은 지난 7월 30일, 31일 중국 상하이에서 ‘제12차 고위급 무역협상’을 개최했습니다.  회의에서 미·중 협상대표단은 양국 무역갈등의 주요 쟁점사항인 강제기술 이전, 지적재산권, 서비스, 비관세 장벽, 농산물 수입 문제 등을 논의했습니다.  이번 고위급 무역협상에 대한 미·중 정부의 긍정적 평가에도 불구하고, 주요 언론은 협상이 상징적 수준에 그쳤다고 지적하고 있습니다.   주요 쟁점에 대한 양측의 입장차로 인해 협상 장기화의 우려도 제기되고 있는 가운데, 양측은 오는 9월, 미국 워싱턴에서 관련 협상을 이어가기로 했습니다.  [말레이시아·중국] 말레이시아 East Coast Rail Link 사업 재개 말레이시아 정부는 지난 7월 25일, 중국의 일대일로 주요 사업 중 하나인 East Coast Rail Link 사업, 이하 ECRL 프로젝트를 재개했습니다.  ECRL 프로젝트는 말레이시아 정부가 중국건설유한회사와 합작해 진행하는 동해안 철도건설 사업입니다.   ECRL 프로젝트를 통해, 말레이시아는 상대적으로 낙후된 동부해안지역을 수도권과 연결하여 물류 인프라를 구축할 수 있고, 중국은 말라카해협을 거치지 않는 대체 수송로를 확보할 수 있어 협력의 장점이 예상됩니다.  ※관련 연구보고서는 아래 링크에서 확인하세요!  ▶ 제12차 미·중 고위급 무역협상 상하이 개최 - http:bit.ly2GSTCHj ▶ 말레이시아 East Coast Rail Link 사업 재개 - http:bit.ly2yFqMWi  #대외경제정책연구원 #KIEP #글로벌이슈브리핑 #미국 #중국 #고위급 #무역협상 #상하이 #개최 #말레이시아 #ECRL사업 #재개 #중국합작 #철도건설"|https://i.ytimg.com/vi/AKO3vTHffyk/default.jpg|"대외경제정책연구원KIEP글로벌이슈브리핑미국중국고위급무역협상상하이개최말레이시아ECRL사업재개중국합작철도건설철도ECRL"|27|ko|PT4M32S|true|177|5|1|0
Qlf366gDrMc|2019-07-30T04:34:32Z|UCM_0SZaSF2KSxQZiYOIcCfg|"[KIEP 영상보고서] 2019 세계경제전망(업데이트)"|"[KIEP 영상보고서] 2019 세계경제전망(업데이트)  ※본 영상은 성우 나래이션한글자막 기능이 추가되어 있습니다.    올해도 여김없이 다양한 국제이슈들로 뜨겁습니다! 올해 세계경제전망률은 몇퍼센트로 예상될까요? 각국에서는 어떤 이슈들이 전망치의 배경으로 거론될까요?  궁금하시다면~ ˘▽˘  KIEP의 대표보고서인 "2019년 세계경제전망(업데이트)"를,  모션그래픽 영상으로 확인하실 수 있습니다! ᕕ( ᐛ )ᕗ  미국, 유럽, 일본 등 주요국부터 중국, 인도, 아세안, 러시아, 브라질 등 신흥국까지~ 주요국과 신흥국 경제성장률, 구체적으로 각 나라별 경제성장률 전망치와 전망내용 확인하세요!  보다 자세한 내용은, 관련 연구보고서를 통해 별도로 확인하실 수 있습니다. ※관련 연구보고서는 아래 링크에서 다운받으실 수 있습니다.  ▶ [KIEP 오늘의 세계경제] 2019년 세계경제전망(업데이트) 보고서 다운로드 - http:bit.ly2VtZET9  #대외경제정책연구원 #KIEP #영상보고서 #2019년 #세계경제전망 #각국 #경제성장률 #전망치 #주요국부터 #신흥국까지 #자세한정보 #전망원인 #확인하세요!"|https://i.ytimg.com/vi/Qlf366gDrMc/default.jpg|"대외경제정책연구원KIEP영상보고서#대외경제정책연구원 #KIEP #영상보고서 #세계경제전망각국경제성장률#경제전망#세계경제#GDP#대외연#글로벌경제"|27|ko|PT5M1S|true|470|14|0|2
2vgU-p-zAXQ|2019-07-24T09:43:54Z|UCM_0SZaSF2KSxQZiYOIcCfg|"[Vol.9] 인도네시아 자동차산업 신규투자, 중국 24분기 거시경제 동향"|"[Vol.9] 인도네시아 자동차산업 신규투자, 중국 24분기 거시경제 동향  대외경제정책연구원은 "KIEP 글로벌 이슈브리핑 코너"를 통해 KIEP 연구진 자료를 토대로 한 최신 국제이슈, 중요 글로벌동향을 전하고 있습니다.  금주 살펴볼 곳은 '인도네시아'와 '중국' 입니다.  [인도네시아] 인도네시아 자동차산업 신규투자 유치 인도네시아 정부는 도요타와 현대자동차가 대규모 투자를 통한 완성차 공장 건설을 확정했다고 발표했습니다.  동남아시아 최대규모인 인도네시아 자동차 시장은 최근 빠른 성장세를 이어가며, 글로벌 자동차 기업들의 신규투자에 적극 나서고 있습니다.  정부의 정책적 육성의지와 글로벌 기업들의 투자 유치가 함께 맞물리면서, 인도네시아 자동차 산업은 향후에도 지속적인 성장이 기대됩니다.  [중국] 중국 24분기 거시경제 동향 중국 국가통계국에 따르면 올해 중국의 24분기 경제성장률은 지난 분기 대비 0.2%p 하락한 6.2%를 기록하였으나, 월별로 살펴보면 일부 지표는 6월부터 회복 기미를 보이고 있습니다.  중국 정부는 미·중 무역분쟁이 본격적으로 진행된 작년 하반기부터 각종 경기부양책을 운용하며 대내외 경기하방압력에 적극적으로 대응해왔습니다.  중국 정부의 정책지원으로 인하여 투자 및 소비 시장은 회복세를 보일 것으로 예측되나, 미·중 무역분쟁 장기화가 하반기 경제성장의 여전한 리스크 요인으로 작용할 것으로 보입니다.  ※관련 연구보고서는 아래 링크에서 확인하세요!  ▶ 인도네시아 자동차산업 신규투자 유치 - http:bit.ly2Gscpsw ▶ 중국 24분기 거시경제 동향 - http:bit.ly2SxQpkV  #대외경제정책연구원 #KIEP #글로벌이슈브리핑 #인도네시아 #글로벌 #자동차기업 #완성차공장 #유치 #자동차산업 #투자유치 #활발 #중국 #거시경제전망 #6.2%기록 #전년동기대비 #하락세 #미중무역분쟁 #영향 #경기부양책운용 #경기하방압력 #적극대응"|https://i.ytimg.com/vi/2vgU-p-zAXQ/default.jpg|"대외경제정책연구원KIEP글로벌이슈브리핑인도네시아중국거시경제전망미중무역분"|27|ko|PT3M34S|true|192|16|0|0
BFVBeK2rBrk|2019-07-10T10:54:05Z|UCM_0SZaSF2KSxQZiYOIcCfg|"[Vol.8] 글로벌 이슈브리핑  OPEC+, 미국·중국"|"[Vol.8] 글로벌 이슈브리핑  OPEC+, 미국·중국  대외경제정책연구원은 "KIEP 글로벌 이슈브리핑 코너"를 통해 KIEP 연구진 자료를 토대로 한 최신 국제이슈, 중요 글로벌동향을 전하고 있습니다.  금주 살펴볼 곳은 'OPEC+'와 '미국·중국' 입니다.  [OPEC+] 주요 산유국 2020년 3월까지 원유 감산연장 합의 주요 산유국들은 올해 6월말까지로 예정됐던 원유 감산정책을 2020년 3월까지 연장하기로 합의했습니다.   지난 7월 1일부터 이틀간 오스트리아 빈에서 개최된 ‘OPEC 정례회의’ 및 ‘OPEC+ 회의’에서, 주요 산유국들은 2020년 3월까지 일일생산량 기준 OPEC국가 80만 배럴, 비OPEC국가 40만 배럴의 원유감산을 연장하기로 결정하였습니다.  감산연장의 배경에는 미국의 셰일오일 생산 확대로 인해 원유 공급은 증가하고 있지만, 글로벌 무역분쟁, 유럽과 아시아 국가들의 성장 둔화 등으로 원유 수요 감소가 예측되는 점 등이 꼽혔습니다.   [미국·중국] G20회의 기간 미중 정상회담 개최 지난 6월 28일, 29일 양일간 일본 오사카에서 G20 정상회담이 개최됐습니다.  회담기간인 29일, 중국의 시진핑 국가주석은 미국의 트럼프 대통령과 정상회담을 개최했으며, 양국은 추가관세부과와 화웨이 제재, 대만 문제, 북한문제 등을 논의했습니다.  이번 회담 결과, 격화되던 양국 간 대립이 잠정 중단되고, 중국정부가 대외개방 확대를 위한 정책을 발표하면서, 미중 무역협상의 합의 도출 기대감이 다시 대두되고 있습니다.   그러나 여전히 미국은 화웨이 제재를 지속하고 있으며, ‘통신장비’에 한정됐던 미국의 중국기술 제재가 ‘슈퍼컴퓨터로’ 확대되는 양상을 보이면서 향후 재개될 무역협상의 결과를 낙관하기는 어려운 상황입니다.  ※관련 연구보고서는 아래 링크에서 확인하세요!  ▶ 주요 산유국 2020년 3월까지 원유 감산연장 합의 - http:bit.ly2Vv9Fkw ▶ G20회의 기간 미중 정상회담 개최 - http:bit.ly2IGIFJF  #대외경제정책연구원 #KIEP #글로벌이슈브리핑 #중동지역 #OPEC #OPEC+ #OPEC플러스 #감산정책 #연장 #합의 #미국 #중국 #G20 #미중정상회담 #진행 #양국 #추가관세부과 #화웨이제재 #논의"|https://i.ytimg.com/vi/BFVBeK2rBrk/default.jpg|"대외경제정책연구원KIEP글로벌이슈브리핑중동지역OPECOPEC+OPEC플러스G20미국중국미중정상회담진행"|27|NULL|PT3M33S|false|142|26|0|4
4ReT0R2IM3E|2019-07-02T09:11:19Z|UCM_0SZaSF2KSxQZiYOIcCfg|"[Vol.7] 오만만 유조선 피격, 이민정책 관련 미·멕 갈등"|"[Vol.7] 글로벌 이슈브리핑  중동, 중남미  대외경제정책연구원은 "KIEP 글로벌 이슈브리핑 코너"를 통해 KIEP 연구진 자료를 토대로 한 최신 국제이슈, 중요 글로벌동향을 전하고 있습니다.  금주 살펴볼 지역은 '중동'과 '중남미' 지역입니다.  [중동] 오만 만 유조선 피격으로 중동 내 긴장 고조  지난 6월 13일, 중동산 원유의 주요 수송로인 호르무즈 해협 인근 오만 만에서 유조선 두 척이 공격을 받으며 중동 지역 내 긴장이 고조됐습니다.  미국은 이번 공격의 배후로 이란을 지목했으나 이란은 이러한 주장을 강하게 반박하고 있습니다.  추가적인 선박 공격이 발생할 가능성을 배제할 수 없는 가운데, 미국과 이란의 갈등이 심화되면서 중동 지역의 지정학적 리스크가 확대될 것으로 전망됩니다.  [중남미] 이민정책을 둘러싼 미국-멕시코 갈등과 향후 전망  미국과 멕시코 양국은 중미 이주자들의 미국 입국에 대해, 적극적인 조치를 취하기로 합의했습니다.   중미 북부삼각지대 국가들의 경제적·사회적 불안정성이 나아지지 않자, 시민들이 일명 '캐러밴'을 형성하여 미국으로 불법 이주하고 있습니다.   이에 미국과 멕시코 양국이 해결방안을 모색하고 있지만, 해당 국가들 내 빈곤, 쿠데타 등 문제들이 해결되지 않는 한 시민들의 이주행렬을 막기는 어려울 것으로 보입니다.  ※관련 연구보고서는 아래 링크에서 확인하세요!  ▶ 오만 만 유조선 피격으로 중동 내 긴장 고조 - http:bit.ly2NfWW4J ▶ 이민정책을 둘러싼 미국-멕시코 갈등과 향후 전망 - http:bit.ly2YhANUS  #대외경제정책연구원 #KIEP #글로벌이슈브리핑 #중동지역 #이란 #오만만 #유조선 #공격 #미국 #멕시코 #불법이주문제 #이슈 #캐러밴 #행렬 #지속"|https://i.ytimg.com/vi/4ReT0R2IM3E/default.jpg|"대외경제정책연구원KIEP글로벌이슈브리핑중동지역이란오만만유조선공격미국멕시코불법이주문제이슈캐러밴행렬지속"|27|NULL|PT4M9S|false|144|12|0|0
dtIzVgrpHTI|2019-06-13T09:17:48Z|UCM_0SZaSF2KSxQZiYOIcCfg|"[Vol.6] 토요타, 미얀마에 완성차 공장 설립, 남아공 탄소세 도입"|"[Vol.6] 토요타, 미얀마에 완성차 공장 설립, 남아공 탄소세 도입  대외경제정책연구원은 'KIEP 글로벌 이슈브리핑' 코너를 통해 KIEP 연구진 자료를 토대로 한 최신 국제이슈, 중요 글로벌동향을 전하고 있습니다.  금주 살펴볼 지역은 "미얀마"와 "남아프리카공화국" 입니다.  [미얀마] 지난 5월, 일본의 대표 자동차기업 토요타는 미얀마 현지에 완성차 공장을 설립할 계획을 공식 발표했습니다.  미얀마의 수입중고차 규제가 강화되면서 반대급부로 미얀마 내 신차 시장이 성장하기 시작했고, 이에 토요타가 경쟁력 확보를 위해 투자를 단행한 것이 관련배경으로 분석됩니다.  [남아프리카공화국] - 남아프리카공화국이 6월부터 탄소세를 도입했습니다.   남아공이 탄소세를 도입하게 된 배경에는, 파리협약 이행의무와 더불어 화력발전에 집중된 에너지원의 다변화 필요성, 기후변화로 인한 직접적인 피해증가 때문인 것으로 분석됩니다.   ※관련 연구보고서는 아래 링크에서 확인하세요!  ▶ 토요타(Toyota), 미얀마 현지 완성차 공장 설립 발표 - http:bit.ly2IdITIn ▶ 남아프리카공화국 탄소세 도입의 배경 및 시사점 - http:bit.ly2ZozT9c  #대외경제정책연구원 #KIEP #글로벌이슈브리핑 #미얀마 #현지 #토요타 #완성차공장 #설립계획 #남아프리카공화국 #남아공 #6월부터 #탄소세 #도입"|https://i.ytimg.com/vi/dtIzVgrpHTI/default.jpg|"대외경제정책연구원KIEP글로벌이슈브리핑KIEP글로벌이슈브리핑토요타미얀마남아프리카공화국남아공탄소세대외연대외경제이슈브리핑국제뉴스키에프"|27|NULL|PT4M27S|false|152|10|0|1
9TQ0o7yPkT8|2019-06-05T08:45:54Z|UCM_0SZaSF2KSxQZiYOIcCfg|"[기조연설] 이재영 원장, ‘글로벌 경제환경 변화와 한국경제’ 콘퍼런스 기조연설"|"[기조연설] 이재영 원장, ‘글로벌 경제환경 변화와 한국경제’ 콘퍼런스 기조연설  대외경제정책연구원(KIEP) 이재영 원장은 6월 4일(화) 연합인포맥스 창사 19주년을 맞아 서울 여의도 콘래드호텔에서 개최된 ‘글로벌 경제환경 변화와 한국경제’ 콘퍼런스에 참석해 기조연설을 진행했습니다.  이번 행사는 국내외 금융 전문가들이 모여 미·중 간 무역 분쟁 방향 등 글로벌 환경 변화를 진단하고, 우리나라 경제와 금융시장의 미래를 심층적으로 짚어보기 위해 마련된 자리였습니다.  이재영 원장은 “글로벌 경제환경 변화와 한국경제의 도전과제”를 주제로 기조연설을 진행했습니다.  연설을 통해 이재영 원장은 보호무역주의, 미·중 통상분쟁, 브렉시트, 지정학적 리스크 증대 등 불확실성이 고조되고 있는 글로벌 환경 변화 속에서 우리나라는 수출 증가율 둔화, 수출의 고용효과 약화, 수출품목 및 지역 집중화 등 다양한 문제를 안고 있다고 지적했습니다.  또한 문제를 해결하기 위해서 이 원장은 혁신을 통한 산업 경쟁력 제고와 더불어, 미국과 중국 외에 신흥시장으로 진출을 확대해야 한다고 강조했습니다.  자세한 내용은 KIEP 홈페이지를 통해 확인하세요!  ▶ KIEP 홈페이지에서 내용 더 보기-  http:bit.ly2Xqb5x1  #대외경제정책연구원 #KIEP #이재영원장 #글로벌 #경제환경변화 #한국경제 #콘퍼런스 #발표 #연합인포맥스 #창사19주년 #기조연설 #진행 #글로벌경제"|https://i.ytimg.com/vi/9TQ0o7yPkT8/default.jpg|"대외경제정책연구원KIEP이재영원장이재영KIEP원장대외연대외경제대외연합인포맥스기조연설참여"|27|NULL|PT20M27S|false|609|11|0|0
S9D_DZIuIFc|2019-05-22T05:38:39Z|UCM_0SZaSF2KSxQZiYOIcCfg|"[Vol.5] 글로벌 이슈브리핑  브라질, 한·중·일-ASEAN"|"[Vol.5] 글로벌 이슈브리핑  브라질, 한·중·일-ASEAN  대외경제정책연구원은 'KIEP 글로벌 이슈브리핑' 코너를 통해 KIEP 연구진 자료를 토대로 한 최신 국제이슈, 중요 글로벌동향을 전하고 있습니다.  금주 살펴볼 지역은 "브라질"과 "한·중·일-ASEAN" 입니다.  [브라질] 브라질, 석유공기업 페트로브라스 자산 매각 계획 발표 브라질 석유공기업 페트로브라스는 지난 5월 3일, 정유와 유통 부문 자산을 매각하겠다고 밝혔습니다.   이번 매각은 지난 브라질 정부에서 정경유착 비리로 경영악화를 겪은 페트로브라스가, 경영정상화에 주력하는 한편, 브라질 정유시장을 현 독점체제에서 경쟁체제로 전환하려는 노력을 담고 있습니다.  [한중일-ASEAN] 한·중·일-ASEAN 인프라투자파트너십(IIP)추진 논의와 전망 지난 5월 2일 피지 난다에서 한-중-일 3국과 아세안 10개국의 재무장관과 중앙은행 총재들이 참석하는 ’ASEAN+3 재무장관·중앙은행총재 회의‘ 가 열렸습니다. 해당 회의에서 참가국들은 ’인프라투자파트너십‘에 대해 구체적으로 논의했습니다.   인프라투자파트너십은 역내 인프라 투자를 확대함은 물론, 한국의 인프라 관련 기업이 아세안 시장에 진출할 수 있는 기회가 될 수 있어 긍정적으로 평가됩니다.   ※관련 연구보고서는 아래 링크에서 확인하세요!  ▶ 브라질, 석유공기업 페트로브라스 자산 매각 계획 발표 - http:bitly.krFkWVzS ▶ 한·중·일-ASEAN 인프라투자파트너십(IIP)추진 논의와 전망 - http:bitly.kreXodIJ   #대외경제정책연구원 #KIEP #글로벌이슈브리핑 #브라질 #석유공기업 #페트로브라스#자산매각 #계획발표 #한중일 #아세안 #재무장관 #중앙은행총재 #회의#개최#인프라투자파트너십 #논의"|https://i.ytimg.com/vi/S9D_DZIuIFc/default.jpg|"대외경제정책연구원KIEP글로벌이슈브리핑브라질한중일아세안인프라투자파트너십페트로브라스글로벌뉴스해외뉴스세계지역연구지역연구세계경제"|27|NULL|PT3M40S|false|154|6|0|0
iV46OCQTIYo|2019-05-09T05:48:38Z|UCM_0SZaSF2KSxQZiYOIcCfg|"[Vol.4] 몰디브 외국인 토지소유법 폐지, 리비아 내전 재발"|"[Vol.4] 몰디브 외국인 토지소유법 폐지, 리비아 내전 재발  대외경제정책연구원은 'KIEP 글로벌 이슈브리핑' 코너를 통해 KIEP 연구진 자료를 토대로 한 최신 국제이슈, 중요 글로벌동향을 전하고 있습니다.  금주 살펴볼 지역은 "몰디브"와 "리비아" 입니다.  [몰디브] 몰디브, 외국인 토지소유법 폐지로 중국 견제 몰디브가 외국인의 자국토지 소유를 금지하기 시작했습니다. 금지 배경에는 중국에 높게 의존하고 있는 몰디브 경제, 외교정책을 바꾸기 위한 신정부의 정책변화가 담겨있습니다.   몰디브 신정부는 이와 함께 인도우선정책을 추진하고 있어, 남아시아 내 인도와 중국의 영향력 확대 갈등이 치열해지는 양상입니다.  [리비아] 리비아 동서 간 내전 재발 리비아 내전이 약 5년만에 재발했습니다. 리비아는 동부와 서부로 정부가 양분된 상태인데요, 원유자원을 둘러싸고 각 정부들이 국제사회로부터 공식적인 정부로 인정받기 위해 충돌을 감행한 것으로 보입니다.   세계 주요국이 각기 다른 정부를 지지하고 있어, 내전 양상은 더욱 복잡해질 전망입니다.  ※관련 연구보고서는 아래 링크에서 확인하세요!  ▶ 몰디브, 외국인 토지소유법 폐지로 중국 견제 - http:bit.ly2vPuZVG ▶ 리비아 동서 간 내전 재발 - http:bit.ly2VTqGYj  #대외경제정책연구원 #KIEP #글로벌이슈브리핑 #몰디브 #자국토지 #소유금지 #외교노선 #변화 #리비아 #내전재발 #동부정부 #서부정부 #양분 #KIEP #유튜브 #채널에서 #확인하세요!"|https://i.ytimg.com/vi/iV46OCQTIYo/default.jpg|"대외경제정책연구원KIEP글로벌이슈브리핑몰디브리비아"|27|NULL|PT3M33S|false|169|4|0|0
uUZAoJGwVuM|2019-04-25T01:22:31Z|UCM_0SZaSF2KSxQZiYOIcCfg|"[Vol.3] 글로벌 이슈브리핑  일본·중국, 미국·유럽"|"KIEP 글로벌 이슈브리핑은 KIEP 연구진 자료를 토대로 최근 국제이슈 및 세계동향을 소개합니다. 금주 살펴볼 지역은 "일본·중국"과 "미국·유럽" 입니다.  ▶ 제5회 일·중 고위급 경제대화 개최와 평가 - http:bit.ly2PwhOSU ▶ 미-EU 통상 협상 재개 결정: 주요 이슈와 전망   ※관련 연구보고서는, 주제 옆 "링크"를 클릭하셔서 확인하세요!"|https://i.ytimg.com/vi/uUZAoJGwVuM/default.jpg|"대외경제정책연구원KIEP글로벌이슈브리핑일본중국고위급경제대화미국EU통상협상"|27|NULL|PT3M56S|false|135|3|0|0
pHepfD0cIu0|2019-04-10T08:28:03Z|UCM_0SZaSF2KSxQZiYOIcCfg|"[Vol.2] 글로벌 이슈브리핑  인도, 이집트"|"KIEP 글로벌 이슈브리핑은 KIEP 연구진 자료를 토대로 최근 국제이슈 및 세계동향을 소개합니다. 금주 살펴볼 지역은 "인도"와 "이집트"입니다.  ▶ 2019 인도총선 이슈와 전망 - http:bit.ly2VwQ2rj ▶ 이집트, 천연가스 허브 조성 본격화 - http:bit.ly2UJmmu5  ※관련 연구보고서는, 주제 옆 "링크"를 클릭하셔서 확인하세요!  #대외경제정책연구원 #KIEP #글로벌이슈브리핑 #인도 #총선 #이집트 #천연가스 #허브"|https://i.ytimg.com/vi/pHepfD0cIu0/default.jpg|"대외경제정책연구원KIEP글로벌이슈브리핑인도총선이집트천연가스허브"|27|NULL|PT3M22S|false|319|11|0|2
dJJny4BlJXE|2019-04-03T08:05:50Z|UCM_0SZaSF2KSxQZiYOIcCfg|"[Vol.1] 글로벌 이슈브리핑  중국, 인도·파키스탄"|"대외경제정책연구원(KIEP)은 2주 간격으로, 국제 이슈를 비롯한 세계 동향을 간단하게 소개하는  "KIEP 글로벌 이슈브리핑" 코너를 진행합니다. ^ ^  - 금주 목차는 아래와 같습니다. △베이징 서비스업 3차 대외개방조치 발표- http:bit.ly2Uq0YuE △인도-파키스탄 군사적 충돌 및 대치- http:bit.ly2WFkQX7 △카타르 금융센터(QFC) 전략비전 2022 발표- http:bit.ly2FQx5t1 △그 외 국제이슈  보다 자세한 내용은 목차 옆 "링크"를 클릭, 관련 보고서로 확인하세요!"|https://i.ytimg.com/vi/dJJny4BlJXE/default.jpg|"대외경제정책연구원KIEP글로벌이슈브리핑KIEP글로벌이슈브리핑세계경제세계경제동향"|27|NULL|PT2M49S|false|214|7|0|0
