id|publishedAt|channelId|title|description|thumbnailUrl|tags|category|defaultLanguage|duration|caption|viewCount|likeCount|dislikeCount|commentCount
8z5KqSbVB8M|2020-07-16T01:31:40Z|UCKfDOknt5Ia7wjWCYbQwefQ|"※주의: 취업꿀팁 포함※ 차량직 신입사원이 알려주는 서교공의 모든 것!"|"※주의: 이 영상은 신입사원이 알려주는 취업꿀팁이 포함되어 있습니다※  차량직렬 신입사원이 알려주는  서울교통공사의 모.든.것.😲  취업성공후기부터, 공사의 장단점까지 필터없이 싹쓰리 공개!  영상이 마음에 드셨다면, 구독👍 좋아요💕 눌러주세요🥰  #서울교통공사  #신입사원  #채용 #새내기 #취업 #꿀팁 #합격#서울 #지하철 #서울지하철 #공기업"|https://i.ytimg.com/vi/8z5KqSbVB8M/default.jpg|NULL|2|ko|PT6M23S|false|1251|66|2|14
cXXbmNR4Ccc|2020-07-13T07:11:55Z|UCKfDOknt5Ia7wjWCYbQwefQ|"또타! 어디가?_차량사업소편_[차량정비 신입사원 브이로그]"|"서울지하철 2호선 정비 어떻게 하는지 궁금하셨나요?🤷‍♀️ 2019년 12월 입사한 신입사원이 직접! 알려드립니다😊  차량 정비 모습부터, 신정차량사업소 구내식당, 취업준비팁 까지 브이로그로 최.초.공.개!  영상이 마음에 드셨다면 구독💕 좋아요👍 눌러주세요  #서울교통공사 #신입사원 #브이로그 #2호선 #차량사업소 #공기업 #서울 #지하철 #서울지하철  #구내식당 #취업 #최초공개 #철덕 #취준생 #주목하세요"|https://i.ytimg.com/vi/cXXbmNR4Ccc/default.jpg|NULL|2|ko|PT13M8S|false|3046|154|4|17
AkvKktiJuKg|2020-07-06T02:22:54Z|UCKfDOknt5Ia7wjWCYbQwefQ|"당신이 내린 사이에 :  코로나19 극복·응원 콘텐츠 글로벌 공모전 수상작 [입선]"|"코로나19 극복·응원 콘텐츠 글로벌 공모전 [입선 ]수상작 입니다.  공사 직원이 개인적인 노력을 통해 받은 작품이라   더욱 뜻깊은 작품이 아닐까 싶습니다.  공사 직원들의 이러한 관심이 코로나19 극복의 밑거름이 되길 바라며..  #코로나19 #서울교통공사 #공모전 #수상작 #입선 #극복 #응원 #콘텐츠"|https://i.ytimg.com/vi/AkvKktiJuKg/default.jpg|NULL|2|ko|PT4M37S|false|680|36|1|13
eN0tfFwYa8Y|2020-06-18T00:12:48Z|UCKfDOknt5Ia7wjWCYbQwefQ|"브레드가 지하철을 못 탄 이유는? "지하철 에티켓_음식물 STOP!""|"지하철을 타려던 브레드(빵), 윌크(우유), 초코, 치즈! 그런데! 또타는 왜 지하철을 못 타게 했을까요?🙄  서로를 지키고 배려하는 지하철 에티켓! 먹던 음식물, 개봉된 음료수, 냄새나는 음식물을 들고는 지하철에 탈 수 없어요! 모두 지켜 주실꺼죠?😊  * 화질 조정을 위해 재 업로드 하였습니다.   #서울 #지하철 #서울지하철 #서울교통공사 #또타 #SeoulMetro #TTOTA #브레드이발소 #브레드 #윌크 #초코 #치즈 #에티켓 #약속 #음식물STOP!"|https://i.ytimg.com/vi/eN0tfFwYa8Y/default.jpg|NULL|2|ko|PT48S|false|4139|72|8|28
qccK97mojeY|2020-06-11T02:16:53Z|UCKfDOknt5Ia7wjWCYbQwefQ|"브레드 이발소와 함께 코로나19 싹쓰리!"|"끝날 듯 끝나지 않는 #코로나19 로 많이 지치고 힘드시죠? #브레드이발소와 함께 #코로나19 이겨내요!  #서울교통공사 #브레드이발소 #서울 #지하철 #서울지하철 #KOREA #SEOUL #SeoulMetro  #COVID19 #코로나19 #응원"|https://i.ytimg.com/vi/qccK97mojeY/default.jpg|NULL|2|ko|PT41S|false|4187|76|3|19
WhYsUTvLNVc|2020-06-09T00:49:33Z|UCKfDOknt5Ia7wjWCYbQwefQ|"또타 어디가?_ 충무로유실물센터편"|"또타 어디가? 두번째 이야기 '충무로유실물센터' 편입니다 한번쯤 이용해 보셨을 아님 앞으로 이용하게 될지도 모르는 유실물에 관한 이야기입니다 #또타어디가? #또타 #충무로유실물센터 #지하철 #서울교통공사 #seoulmetro #충무로역 #지하철3호선 #서울지하철"|https://i.ytimg.com/vi/WhYsUTvLNVc/default.jpg|NULL|2|ko|PT10M11S|false|2534|68|1|43
MoQ8ZvZcTjM|2020-05-20T05:46:22Z|UCKfDOknt5Ia7wjWCYbQwefQ|"［5분 다큐］다시, 하루 - 서울 지하철 24시간"|"당신이 몰랐던 시간 하지만 당신을 위한 시간   서울교통공사 그 하루.  #서울교통공사 #지하철   #KOREA #SEOUL #SeoulMetro #COVID19 #코로나19 #비켜 #착한 #마스크  #방역 #소독  #안내방송"|https://i.ytimg.com/vi/MoQ8ZvZcTjM/default.jpg|NULL|2|ko|PT4M59S|false|3286|192|3|23
_5737VNCZ28|2020-05-20T00:47:03Z|UCKfDOknt5Ia7wjWCYbQwefQ|"일상이 다시 꽃처럼 만발할 때까지"|"매일 아침 세상 가장 덤덤한 얼굴로 만나지만 변함없이 당신의 하루를 응원합니다.  새벽부터 늦은 밤까지 당신의 삶터를 오가는 익숙하고 편한 신발이 되길 원합니다.  우리 힘내요! 일상이 다시 꽃처럼 만발할 때까지 오늘도, 그리고 내일도 서울교통공사가 함께할께요  #힘내라대한민국#힘내세요#코로나19#서울교통공사"|https://i.ytimg.com/vi/_5737VNCZ28/default.jpg|"우리힘내요코로나19극복서울교통공사코로나19극복체험글로벌콘텐츠공모전"|2|ko|PT4M5S|false|1722|66|2|14
Y2jXDCz1wdw|2020-05-12T02:19:11Z|UCKfDOknt5Ia7wjWCYbQwefQ|"몰랑이와 함께 지키는 스마트폰 사용예절"|"열차내에서 큰소리로 통화하지 않기 스마트폰 보면서 걷지 않기 벨소리는 진동으로 우리모두 함께 지켜요~  #몰랑 #지하철 #예절 #서울교통공사"|https://i.ytimg.com/vi/Y2jXDCz1wdw/default.jpg|"몰랑스마트폰예절서울교통공사"|2|ko|PT38S|false|2054|72|5|13
zKqkfaUJcqg|2020-05-06T04:39:01Z|UCKfDOknt5Ia7wjWCYbQwefQ|"또타! 어디가?_지하철 최초전동차편"|"1974년 1호선 개통으로 시작된 서울지하철의 역사, 그 역사의 산증인 지하철 최초전동차를 소개합니다  #또타 #최초 #전동차 #지하철 #1호선 #서울교통공사"|https://i.ytimg.com/vi/zKqkfaUJcqg/default.jpg|"지하철최초전동차101편성서울교통공사신정차량사업소"|2|ko|PT13M7S|false|6000|213|8|67
USv8kot5gRY|2020-05-04T02:10:34Z|UCKfDOknt5Ia7wjWCYbQwefQ|"서울의 지하철 그리고 서울교통공사"|"지난 3년간의 지하철사진 공모전 수상작 2020년 지하철사진 공모전도 많은 관심 부탁드립니다~"|https://i.ytimg.com/vi/USv8kot5gRY/default.jpg|"지하철사진공모전서울교통공사서울지하철"|2|ko|PT1M53S|false|1305|106|5|18
QtJ4ICZ9vQc|2020-04-27T00:04:55Z|UCKfDOknt5Ia7wjWCYbQwefQ|"몰랑이와 함께 지키는 기침예절"|"프랑스 애니메이션 제작배급사인 밀리마주와 함께 '몰랑이' 캐릭터로 제작한 기침예절 영상 입니다 기침할땐 옷소매로 입을 가리고~~~  #몰랑 #지하철 #예절 #서울교통공사"|https://i.ytimg.com/vi/QtJ4ICZ9vQc/default.jpg|"몰랑기침예절서울교통공사"|2|ko|PT37S|false|3700|135|5|36
mF9TAVkTBG0|2020-03-30T05:35:49Z|UCKfDOknt5Ia7wjWCYbQwefQ|"평일 심야시간대 서울지하철 1시간 단축운행 실시"|"코로나19(COVID-19)유행의 장기화로 인한 강도 높은 '사회적 거리두기'와 지속가능한 '안전 및 방역품질 확보'를 위해 2020년 4월1일부터 평일 심야시간대 서울지하철 1시간 단축운행을 실시합니다."|https://i.ytimg.com/vi/mF9TAVkTBG0/default.jpg|NULL|2|ko|PT25S|false|564|13|1|4
QKzHf3c7P_4|2020-03-25T07:04:54Z|UCKfDOknt5Ia7wjWCYbQwefQ|"미세먼지 게 섰거라!  청담역 미세먼지 프리존"|"미세먼지가 기승을 부리는 계절이 왔습니다. 미세먼지 제로인 청담역에서 상쾌한 봄을 만끽하세요!"|https://i.ytimg.com/vi/QKzHf3c7P_4/default.jpg|"청담역미세먼지프리존미세먼지제로청담역서울교통공사"|2|ko|PT2M36S|false|393|14|2|3
5Vau5rihiiw|2020-03-20T01:17:28Z|UCKfDOknt5Ia7wjWCYbQwefQ|"우리 함께 이겨내요!"|"서울교통공사는 지하철 역사내와 전동차내 방역소독에 최선을 다하고 있습니다 우리는 반드시 이겨낼 수 있습니다"|https://i.ytimg.com/vi/5Vau5rihiiw/default.jpg|"코로나19방역지하철방역소독서울교통공사함께이겨내요"|2|ko|PT1M18S|false|2034|30|3|10
pMmWB2mfVos|2020-03-03T04:54:34Z|UCKfDOknt5Ia7wjWCYbQwefQ|"코로나19 우리는 반드시 극복할 수 있습니다!"|"서울교통공사는 코로나19 위기경보 "심각" 단계 격상에 따라 시민 안전을 위해 방역활동을 강화하고 있습니다. 역사 및 전동차 내 소독주기를 단축하고, 확진자 발생 시 긴급방역을 실시하고 있으니 시민여러분께서는 안심하고 지하철을 이용해 주시기 바랍니다."|https://i.ytimg.com/vi/pMmWB2mfVos/default.jpg|NULL|2|ko|PT36S|false|1051|39|1|3
6ygnFIcf7eE|2020-02-27T08:53:00Z|UCKfDOknt5Ia7wjWCYbQwefQ|"서울 도심집회 제한 확대안내"|"코로나19 확산 방지를 위한 도심내 집회 금지가 확대 됩니다 서울역광장, 서울청계광화문광장, 효자동삼거리광장,신문로,종로1가, 광화문광장-국무총리공관 도로 및 주변 인도 등"|https://i.ytimg.com/vi/6ygnFIcf7eE/default.jpg|NULL|2|ko|PT21S|false|205|11|0|0
lWl6FWw8Bdc|2020-02-26T07:57:01Z|UCKfDOknt5Ia7wjWCYbQwefQ|"코로나바이러스감염증-19 행동수칙_의심시"|"발열, 기침 등 호흡기 증상이 있을시 응급실 방문자제 전화먼저하기(관활보건소1339120) 의료기관 방문시 마스크 꼭 착용, 자차 이용 권고"|https://i.ytimg.com/vi/lWl6FWw8Bdc/default.jpg|NULL|2|ko|PT21S|false|274|11|1|1
aTZntzjmqvE|2020-02-26T07:46:45Z|UCKfDOknt5Ia7wjWCYbQwefQ|"코로나바이러스감염증-19 국민예방수칙"|"* 가급적 외부활동 자제 * 손씻기, 기침예절 준수 * 발열, 호흡기 증상시 선별진료소 방문     또는 관활보건소, 지역120콜센타, 1339콜센타 상담"|https://i.ytimg.com/vi/aTZntzjmqvE/default.jpg|NULL|2|ko|PT30S|false|378|15|0|2
YF0MtotqOF0|2020-01-28T07:48:33Z|UCKfDOknt5Ia7wjWCYbQwefQ|"나만을 위한 구두! 성수역으로_수제화 테마역사"|"수제화를 주제로한 성수역 수제화테마역사 입니다 우리나라 수제화의 역사와 제작상식, 제작도구등 다양한 볼거리와 1번출구로 나가면 수제화거리가 있어 쇼핑도 즐길 수 있어요"|https://i.ytimg.com/vi/YF0MtotqOF0/default.jpg|"성수역수제화테마역사수제화거리겨울방학체험서울교통공사"|2|ko|PT1M21S|false|403|21|1|4
Q20vwrnd_Ug|2020-01-20T08:12:14Z|UCKfDOknt5Ia7wjWCYbQwefQ|"과학이 궁금하다면... 상월곡역으로!"|"6호선 상월곡역에서 과학여행을 할 수 있다??!! 서울교통공사 테마역사 '사이언스 스테이션 상월곡역 편'"|https://i.ytimg.com/vi/Q20vwrnd_Ug/default.jpg|"상월곡역사이언스스테이션서울교통공사테마역사상월곡역사이언스스테이션"|2|ko|PT1M59S|false|629|25|1|10
xaeJ9Mah4E8|2020-01-14T08:20:04Z|UCKfDOknt5Ia7wjWCYbQwefQ|"당신의 배려를 보여주세요"|"서울교통공사와 티머니복지재단이 협업하여 만든 지하철 에티켓 홍보영상입니다 '당신의 배려를 보여주세요' 배려의 실천이 모두를 웃게 합니다."|https://i.ytimg.com/vi/xaeJ9Mah4E8/default.jpg|"지하철에티켓홍보영상당신의배려를보여주세요서울교통공사티머니복지재단"|2|ko|PT1M1S|false|1476|36|1|5
8o9Hl-54e4c|2020-01-14T08:10:22Z|UCKfDOknt5Ia7wjWCYbQwefQ|"지하철에서 무심코 한 행동 나도 혹시?"|"지하철 안전,에티켓 홍보 애니메이션 2편 지난 1편 과일에 이어 이번 2편에선 다양한 동물들을 의인화해서 지하철에서 해서는 안되는 행동을 재밌는 애니메이션으로 표현했습니다   다함께 편리하고 행복한 지하철을 만들어 가요"|https://i.ytimg.com/vi/8o9Hl-54e4c/default.jpg|"지하철안전홍보애니메이션서울교통공사애니메이션"|22|ko|PT1M6S|false|2395|41|1|4
Ri4ZuAx8bIQ|2019-12-18T06:26:13Z|UCKfDOknt5Ia7wjWCYbQwefQ|"뽀로로와 함께하는 철도 건널목 사고 예방 안전 수칙"|"뽀로로와 함께하는 안전 홍보 동영상입니다. 많은 시청 바랍니다."|https://i.ytimg.com/vi/Ri4ZuAx8bIQ/default.jpg|NULL|22|ko|PT40S|false|6987|63|4|4
O8AWnTg6Cmk|2019-12-18T06:23:22Z|UCKfDOknt5Ia7wjWCYbQwefQ|"뽀로로와 함께하는 열차사고 발생 시 행동요령"|"뽀로로와 함께하는 안전 홍보 동영상입니다. 많은 시청 바랍니다."|https://i.ytimg.com/vi/O8AWnTg6Cmk/default.jpg|NULL|22|ko|PT47S|false|4476|45|4|4
QKA24RkrHbM|2019-12-03T01:17:41Z|UCKfDOknt5Ia7wjWCYbQwefQ|"신형 전동차, 한번 만나볼까요?"|"본 영상은 서울 지하철 2호선 신형 전동차의 달라진 점을 설명하기 위해 제작되었습니다. 별도의 음성이나 배경음악이 없는 점 양해 바랍니다."|https://i.ytimg.com/vi/QKA24RkrHbM/default.jpg|NULL|22|ko|PT1M17S|false|18898|267|8|112
t3NNJLyI10Y|2019-11-28T04:53:09Z|UCKfDOknt5Ia7wjWCYbQwefQ|"지하철 이용을 보다 편리하게_또타지하철앱"|"지하철역 편의시설, 교통약자이용정보, 긴급상황시 신고 및 민원신고까지 또타지하철앱으로 한방에 해결하세요~~ 지하철운영기관인 서울교통공사에서 직접 개발한 지하철앱 또타지하철앱입니다"|https://i.ytimg.com/vi/t3NNJLyI10Y/default.jpg|"또타지하철앱또타지하철앱서울교통공사"|22|ko|PT31S|false|4434|58|5|7
CMascyuFlY4|2019-11-18T08:42:31Z|UCKfDOknt5Ia7wjWCYbQwefQ|"시민과 함께한 터널체험 현장 3차 합정역에서 홍대입구역"|"11월16일 지하철 환경 REAL 체험 마지막 3차 행사가 합정역에서 진행되었습니다. 3차에 걸쳐 진행된 지하철 환경 REAL 체험, 시민여러분의 성원에 감사드립니다"|https://i.ytimg.com/vi/CMascyuFlY4/default.jpg|"지하철환경REAL체험지하철터널체험지하철터널청소체험서울교통공사"|22|ko|PT2M20S|false|814|24|1|2
-RlUzPp-Kg8|2019-11-15T02:02:49Z|UCKfDOknt5Ia7wjWCYbQwefQ|"지하예술정원_녹사평역테마역사"|"공공미술과 정원의 만남, 지하예술정원 녹사평역을 소개합니다"|https://i.ytimg.com/vi/-RlUzPp-Kg8/default.jpg|"녹사평역테마역사공공미술서울교통공사"|22|ko|PT1M51S|false|631|20|0|1
y9zc99rvRn4|2019-11-13T05:55:14Z|UCKfDOknt5Ia7wjWCYbQwefQ|"미세먼지 줄이고GO,~ 국민건강 지키고GO~"|"숨 편한 대한민국, 국가기후환경회의와 서울교통공사가 함께 만들어 가겠습니다"|https://i.ytimg.com/vi/y9zc99rvRn4/default.jpg|"미세먼지줄이기캠페인서울교통공사라바국가기후환경회의"|22|ko|PT31S|false|978|38|2|0
T1cfwzQO9W0|2019-10-30T06:01:06Z|UCKfDOknt5Ia7wjWCYbQwefQ|"3.1운동 100년 기념관_안국역 테마역사"|"서울교통공사 테마역사 두번째 안국역 테마역사 3.1운동 100주년 기념관으로 꾸며진 안국역은 100년기둥,100년계단,100년충전소 등 독립운동 역사와 인물들로 만들어져 있습니다"|https://i.ytimg.com/vi/T1cfwzQO9W0/default.jpg|"안국역3.1운동100주년기념관테마역사서울교통공사"|22|ko|PT2M13S|false|418|14|0|0
0fnfQK-JOVc|2019-10-25T08:29:23Z|UCKfDOknt5Ia7wjWCYbQwefQ|"지하철역에서 로봇이 채소재배_상도역 메트로팜"|"조명, 온도, 습도 등을 자동으로 조절해 작물이 자랄 수 있는 최적의 환경을 만드는 7호선 상도역 메트로팜은 팜카페, 팜아카데미등 시민들의 휴게공간과 체험학습 장소입니다"|https://i.ytimg.com/vi/0fnfQK-JOVc/default.jpg|"메트로팜상도역서울교통공사지하철채소"|22|ko|PT41S|false|644|19|1|1
tzijBH6fQYs|2019-10-23T05:39:19Z|UCKfDOknt5Ia7wjWCYbQwefQ|"즐거움이 가득한 테마역사 1편_7호선 반포역 테마역사"|"즐거움,  체험, 역사, 문화등 볼거리가 가득한 서울교통공사 테마역사를 소개합니다. 1편은 디지털시민안전체험관, 안전홍보관, 덕후역대합실이 있는 반포역입니다."|https://i.ytimg.com/vi/tzijBH6fQYs/default.jpg|"테마역사반포역디지털시민안전체험관안전홍보관덕후역대합실서울교통공사"|22|ko|PT1M23S|false|613|19|0|1
RfyOUvfYe5w|2019-10-22T06:00:43Z|UCKfDOknt5Ia7wjWCYbQwefQ|"시민과 함께한 지하철 터널체험 현장"|"3차에 걸쳐 진행되는 '시민공감! 지하철 환경 real 체험'  2차 을지로 4가역에서 출발 터널을 통해 을지로 3가역으로 나오면서 지하철 대청소체험, 터널내 안전점검 시연, 고압살수차를 이용한 터널물청소 등 지하철 환경을 체험하는 행사."|https://i.ytimg.com/vi/RfyOUvfYe5w/default.jpg|"터널체험서울교통공사터널내안전점검고압살수차"|22|ko|PT1M53S|false|994|34|0|3
SJEo0tnX3QA|2019-09-20T01:55:49Z|UCKfDOknt5Ia7wjWCYbQwefQ|"지하철의 새로운 발견_Move the city"|"2019 서울교통공사 지하철 사진 공모전 시상식 식전영상 사진 공모전의 지나온 여정과 결과를 담았습니다"|https://i.ytimg.com/vi/SJEo0tnX3QA/default.jpg|"지하철사진공모전서울교통공사Movethecity"|22|ko|PT3M3S|false|609|18|0|4
h_jsb3xtAGY|2019-09-11T02:22:24Z|UCKfDOknt5Ia7wjWCYbQwefQ|"역직원에게 폭행,폭언 STOP"|"역직원에게 무분별한 폭언과 폭행,성희롱 시 관련법에 따라 처벌받을 수 있습니다"|https://i.ytimg.com/vi/h_jsb3xtAGY/default.jpg|"역직원폭행폭언stop감정노동자서울교통공사주취폭력근절"|22|ko|PT21S|false|934|15|1|2
SbTJ0LyEBOk|2019-09-11T02:18:15Z|UCKfDOknt5Ia7wjWCYbQwefQ|"지하철 성범죄 내가 목격자라면?"|"서울시양성평등위원회와 협업으로 제작한 지하철 성범죄 목격시 대처방안입니다"|https://i.ytimg.com/vi/SbTJ0LyEBOk/default.jpg|"지하철성범죄서울교통공사"|22|ko|PT49S|false|1000|28|3|0
4DnpMfQxxJU|2019-09-11T02:13:45Z|UCKfDOknt5Ia7wjWCYbQwefQ|"중앙정부 무임승차 제도"|"중앙정부 무임승차 제도 모두의 관심과 정부지원이 필요합니다"|https://i.ytimg.com/vi/4DnpMfQxxJU/default.jpg|"무임승차서울교통공사지하철무임승차제도"|22|ko|PT46S|false|576|27|0|2
oOg2wAxONaw|2019-09-11T02:02:48Z|UCKfDOknt5Ia7wjWCYbQwefQ|"오늘은 내가 지하철 기관사"|"2019 지하철 기관사 체험 행사 영상입니다  모의운전연습기, 실제지하철운전, 반포역 디지털시민안전체험관 등 다양하고 신나는 체험행사. 내년에도 기대하세요~"|https://i.ytimg.com/vi/oOg2wAxONaw/default.jpg|"기관사체험서울교통공사철도차량아카데이"|22|ko|PT2M25S|false|5530|81|5|21
vy2N5an4JNM|2019-08-19T05:11:52Z|UCKfDOknt5Ia7wjWCYbQwefQ|"시민과 함께하는 서울교통공사 펜싱교실"|"펜싱 여자국가대표 코치를 역임한 서성준 감독과 런던올림픽 금메달리스트 원우영 선수등 서울교통공사 펜싱선수단에게 직접 배우는 펜싱교실"|https://i.ytimg.com/vi/vy2N5an4JNM/default.jpg|"펜싱2호선뚝섬역서울교통공사펜싱교실"|22|ko|PT3M5S|false|518|17|1|4
ewES5jJ5wbo|2019-08-19T00:54:35Z|UCKfDOknt5Ia7wjWCYbQwefQ|"2019 서울교통공사 국제지하철영화제 트레일러"|"2019 서울교통공사 국제지하철영화제가 8.14 - 9.5 까지 열립니다  현재 지하철 역사내 모니터와 온라인으로 상영되고 있으니 관람하시고 투표 해주세요~ 온라인 상영관 및 투표 사이트  https:smiff.kr"|https://i.ytimg.com/vi/ewES5jJ5wbo/default.jpg|"국제지하철영화제서울교통공사영화제"|22|ko|PT22S|false|583|11|0|3
OYq6sTNCcEg|2019-08-05T05:46:20Z|UCKfDOknt5Ia7wjWCYbQwefQ|"서울교통공사 제11기 메트로아티스트_ 등잔 밑 스튜디오"|"서울교통공사 창립2주년 기념공연 메트로아티스트 '등잔 밑 스튜디오' 의 공연모습입니다. 국악기와 현대악기의 합주가 인상적입니다."|https://i.ytimg.com/vi/OYq6sTNCcEg/default.jpg|"메트로아티스트서울교통공사등잔밑스튜디오통합2주년"|22|ko|PT1M32S|false|335|14|1|3
4baxyEM3EFM|2019-08-02T08:16:05Z|UCKfDOknt5Ia7wjWCYbQwefQ|"2019 서울교통공사 지하철사진 공모전 시민참여 현장 출사(1-4회차)"|"2019 서울교통공사 지하철사진 공모전의 일환으로 시민들이 참여하는 지하철 작업현장 출사를 진행했습니다. 총5회 출사중 1-4회차 출사장면을 담았습니다"|https://i.ytimg.com/vi/4baxyEM3EFM/default.jpg|"지하철사진공모전서울교통공사시민출사"|22|ko|PT1M41S|false|312|13|0|2
ycFMooE_cIU|2019-08-02T04:21:26Z|UCKfDOknt5Ia7wjWCYbQwefQ|"서울시 성평등 생활사전 불법촬영편"|"서울시여성가족재단과 협업해서 제작한 지하철내 불법촬영근절 홍보 애니메이션입니다"|https://i.ytimg.com/vi/ycFMooE_cIU/default.jpg|"불법촬영서울시여성가족재단지하철서울교통공사"|22|ko|PT1M1S|false|1229|20|4|3
7GxRMKKTaC4|2019-08-01T05:11:00Z|UCKfDOknt5Ia7wjWCYbQwefQ|"서울교통공사 지하철에티켓 홍보영상_백팩바로메기"|"웹툰으로 구성한 '백팩바로메기' 지하철에티켓 홍보영상"|https://i.ytimg.com/vi/7GxRMKKTaC4/default.jpg|NULL|22|ko|PT43S|false|993|31|1|5
bOj6-G2269k|2019-08-01T05:06:40Z|UCKfDOknt5Ia7wjWCYbQwefQ|"서울교통공사 제11기 메트로아티스트 매지션 훅의 마술공연"|"서울교통공사 통합 2주년 기념공연에서 메트로아티스트 매지션 훅의 마술공연"|https://i.ytimg.com/vi/bOj6-G2269k/default.jpg|NULL|22|ko|PT1M23S|false|238|13|2|3
YR3ylbN0-TA|2019-08-01T05:01:22Z|UCKfDOknt5Ia7wjWCYbQwefQ|"서울교통공사 제11기 메트로아티스트 정대현"|"서울교통공사 통합2주년 기념공연에서 메트로아티스트 정대현이 부른 동물원의 '시청앞 지하철역에서'"|https://i.ytimg.com/vi/YR3ylbN0-TA/default.jpg|NULL|22|ko|PT4M2S|false|185|9|1|3
kXV3mU6c0gg|2019-07-22T04:51:18Z|UCKfDOknt5Ia7wjWCYbQwefQ|"토닥토닥 꼬모 임산부 배려송"|"토닥토닥 꼬모와 함께하는 임산부 배려송입니다. 많은 관심 부탁드립니다.^^"|https://i.ytimg.com/vi/kXV3mU6c0gg/default.jpg|NULL|22|ko|PT37S|false|7730|104|42|57
xA4l5eXczMQ|2019-07-19T04:59:21Z|UCKfDOknt5Ia7wjWCYbQwefQ|"2019 지하철 사진공모전 시민참여 출사 신정차량사업소편"|"총 5회에 걸처 진행된 2019 지하철 사진공모전 시민참여 출사, 그 마지막회가 서울교통공사 신정차량사업소 정비 주공장에서 진행되었습니다 총 20명의 시민이 참여한 가운데, 저마다의 프레임에 직원들이 땀흘려 일하는 모습을 담았습니다."|https://i.ytimg.com/vi/xA4l5eXczMQ/default.jpg|"서울교통공사신정차량사업소2019지하철사진공모전시민참여출사사진출사"|22|ko|PT1M55S|false|1788|62|0|5
dpGg2tpSJCA|2019-07-01T02:13:53Z|UCKfDOknt5Ia7wjWCYbQwefQ|"메트로아티스트를 소개합니다."|"서울교통공사 문화메신져, 제11기 메트로아티스트를 소개합니다."|https://i.ytimg.com/vi/dpGg2tpSJCA/default.jpg|"서울교통공사메트로아티스트"|22|ko|PT38S|false|548|19|0|4
F1cp8tQyKFc|2019-07-01T02:07:31Z|UCKfDOknt5Ia7wjWCYbQwefQ|"토닥토닥 꼬모와 함께하는 지하철 SONG~!"|"토닥토닥 꼬모와 함께하는 지하철 이용 활성화를 위한 애니메이션 홍보 동영상입니다."|https://i.ytimg.com/vi/F1cp8tQyKFc/default.jpg|"토닥토닥 꼬모지하철서울교통공사"|22|ko|PT52S|false|7957|104|7|13
VlnvX2vjpdA|2019-05-23T02:05:41Z|UCKfDOknt5Ia7wjWCYbQwefQ|"ASA 소개영상(Seoul Metro)"|"Autonomous Scanning Analysis system for Tunnel Facility"|https://i.ytimg.com/vi/VlnvX2vjpdA/default.jpg|NULL|22|ko|PT4M4S|false|891|23|0|10
MO_tOIJwbLc|2019-05-23T02:00:28Z|UCKfDOknt5Ia7wjWCYbQwefQ|"Smart Station_Seoul Metro(Ver.ENG)"|"스마트스테이션 소개 동영상(영문버전)입니다."|https://i.ytimg.com/vi/MO_tOIJwbLc/default.jpg|"Smart stationSeoul Metro"|22|ko|PT4M7S|false|938|12|0|6
Ha5l95pRFBo|2019-04-10T00:43:51Z|UCKfDOknt5Ia7wjWCYbQwefQ|"교통약자 배려 캠페인_삼성전자 대학생 나눔봉사단"|""|https://i.ytimg.com/vi/Ha5l95pRFBo/default.jpg|NULL|22|ko|PT4M51S|false|829|16|0|6
_GABbH4YR0o|2019-01-16T06:55:20Z|UCKfDOknt5Ia7wjWCYbQwefQ|"어서와 한국 지하철은 처음이지 - 문화 편"|"서울교통공사 X MBC에브리원  ▶어서와~ 한국 지하철은 처음이지? - 문화 편  외국인 친구들의 눈에 비친 한국 지하철은 어떤 모습이었을까요?"|https://i.ytimg.com/vi/_GABbH4YR0o/default.jpg|"#서울교통공사 #지하철 #어서와"|22|ko|PT44S|false|3887|38|2|17
ROIvjoVuFm4|2019-01-16T06:42:00Z|UCKfDOknt5Ia7wjWCYbQwefQ|"어서와 한국 지하철은 처음이지 - 기술 편"|"서울교통공사 X MBC에브리원  ▶어서와~ 한국 지하철은 처음이지? - 기술편  외국인 친구들의 눈에 비친 한국 지하철은 어떤 모습이었을까요?"|https://i.ytimg.com/vi/ROIvjoVuFm4/default.jpg|"#서울교통공사 #지하철 #어서와"|22|ko|PT45S|false|5440|59|3|6
De0S2BucHk4|2018-09-06T07:24:47Z|UCKfDOknt5Ia7wjWCYbQwefQ|"모두 함께하는 안전한 지하철"|"서울교통공사는 안전5중방호벽을 통한 안전 고신뢰조직 달성을 목표로 자율적인 예방중심 안전문화 정착을 위해 노력하고 있습니다."|https://i.ytimg.com/vi/De0S2BucHk4/default.jpg|NULL|22|ko|PT2M29S|false|3018|49|0|10
